{"schema_version":"r4-qualification-commitment-v1","status":"FROZEN_BEFORE_BASELINE","qualification_set_id":"pryzael-r4-qualification-cea3a894-v1","packet_schema_version":"r4-qualification-packet-v1","packet_sha256":"892a0c84f1c0adc45bb230efbb5a66cb86150def7ca6fc8fd9d5fcc38381b600","packet_bytes":14743,"task_count":7,"task_index":[{"task_id":"QLF-AMBIG-001","family":"AMBIGUOUS_INCOMPLETE_EVIDENCE_INVESTIGATION","task_digest":"489c20f710fed044c2075410569a011dd2057ea75fd911865f46491ab1026fa7"},{"task_id":"QLF-VERIFY-001","family":"VERIFICATION_COMPLETION_CLAIMS","task_digest":"6c820e4d53e49e0df29af82ff8452d41e65a0863516944142d0fd92042ef6e44"},{"task_id":"QLF-MIGRATE-001","family":"MIGRATION_STAGED_CHANGE_DESIGN","task_digest":"43bd0bc38535c9c9ca7dc1154583b6f2e7314671beb711f38bee485fb1e03a5d"},{"task_id":"QLF-ARCH-ASSUMPTION-001","family":"EXISTING_ARCHITECTURE_IS_VIOLATED_ASSUMPTION","task_digest":"3ea4c942cf1dd0261bcd005cfad3686381378b7a9f5222adfec16b708572082e"},{"task_id":"QLF-OBVIOUS-001","family":"OBVIOUS_SINGLE_SOLUTION","task_digest":"1684d2ec5f62ea31fa9de7bb81b2a4fd8de650789a0bd49d67a7e826cb8d0034"},{"task_id":"QLF-PREMATURE-001","family":"PREMATURE_CONVERGENCE_DANGEROUS","task_digest":"80e92a936ec79cdceaf2673f860aeaa94f17a52014263b8651f5bc8f4041f4e7"},{"task_id":"QLF-REPLAN-001","family":"LEGITIMATE_REPLANNING","task_digest":"4c0d75d4247b7f72194dcab4cf7682ab84ec560291f2e87a1c73daf69130ac2f"}],"created_by_authority":"PRYZAEL_VNEXT_ISOLATED_HELD_OUT_CORPUS_AUTHORITY_RESUME_V2","frozen_at":"2026-08-29T01:54:56Z"}